{"application_version":"0.7.0","archive":{"archive_prefix":"JobFlow-v0.7.0-windows-x64/","bytes":38628522,"name":"JobFlow-v0.7.0-windows-x64-complete.zip","sha256":"sha256:707238221eb22e49eda62c5b4d7bb4221738b7c833ac7fe7fa4e9e6de80345a2"},"build_inputs":{"application_wheel_provenance":{"build_lock_sha256":"sha256:b2deb4864339c5942842758843942472613290da464179a1f1b8a7b0a92d4453","build_recipe_sha256":"sha256:e9813f3f08c6635857d6f6b7c10203f57e223a1ead2629fbb95b14dabcc399d6","format":"JOBFLOW_APPLICATION_WHEEL_PROVENANCE_V1","pass_a_wheel_sha256":"sha256:c2f225402eff95b3bf001610e7016ed27d27a2bc857330b7c520d7d3ece6bf09","pass_b_wheel_sha256":"sha256:c2f225402eff95b3bf001610e7016ed27d27a2bc857330b7c520d7d3ece6bf09","reproducible":true,"source_archive_sha256":"sha256:636f3f0ba4a4ec01e7d19c8fb916e68ca9e2f9da4546a845f32186fe23ad7156","source_build_tree_sha256":"sha256:6d04015de546beb1b78d0c0b972c073e7956e8fac0974cf33afd8d68b38e6b2f","source_commit":"987e8c58826a63cf629a3c84075cf95f725efe28","source_git_tree_oid":"8dd190cf7a0b5d3dd03840f39cb2aadd61ecf463"},"application_wheel_sha256":"sha256:c2f225402eff95b3bf001610e7016ed27d27a2bc857330b7c520d7d3ece6bf09","build_wheel_count":3,"build_wheel_lock_sha256":"sha256:b2deb4864339c5942842758843942472613290da464179a1f1b8a7b0a92d4453","builder_toolchain_sha256":"sha256:9c5016572fe50aa6e36bfb83ae7b523dce50e128da6a770bd1521dac38f40672","runtime_wheel_count":13,"runtime_wheel_lock_sha256":"sha256:fcff92c6cdc59601df54761c44314ec258d9dda39534abe0e5711eb0ab70bc9b","wheelhouse_tree_sha256":"sha256:de63025b9b290411949980b2f26eed49a9ea277979393f1f71f6c31ff3d5bd69"},"build_inputs_sha256":"sha256:133370a9399b3e092e36b56e69054697543f7cefcefe8de418ef030d65fc6793","closure_self_claims":{"outer_signature_ready":false,"sigstore_verified":false},"deterministic_build":{"match":true,"pass_a_archive_sha256":"sha256:707238221eb22e49eda62c5b4d7bb4221738b7c833ac7fe7fa4e9e6de80345a2","pass_a_tree_sha256":"sha256:d9ebaa31948864da0ea56ff57df30d5e9755567ebde70133c349f74fc34df341","pass_b_archive_sha256":"sha256:707238221eb22e49eda62c5b4d7bb4221738b7c833ac7fe7fa4e9e6de80345a2","pass_b_tree_sha256":"sha256:d9ebaa31948864da0ea56ff57df30d5e9755567ebde70133c349f74fc34df341"},"evidence_kind":"SANITIZED_BUILD_OBSERVATION","expires_at_utc":"2026-10-29T23:52:13Z","external_actions":0,"format":"JOBFLOW_RUNTIME_BUILD_EVIDENCE_V1","independent_verification":{"archive_sha256":"sha256:707238221eb22e49eda62c5b4d7bb4221738b7c833ac7fe7fa4e9e6de80345a2","closure_manifest_sha256":"sha256:163fb0f0f4cf3881fac78fa9660ffa9223cdc0b3518cbaa0aee42a12f47e5e4f","status":"PASS","tree_sha256":"sha256:d9ebaa31948864da0ea56ff57df30d5e9755567ebde70133c349f74fc34df341","verifier_sha256":"sha256:aa0459f0737155e02ba5d7155d1a299f3735d0502e5054b9fcb64a2ac6b064d5"},"issued_at_utc":"2026-10-29T00:52:13Z","offline_smoke":{"archive_sha256":"sha256:707238221eb22e49eda62c5b4d7bb4221738b7c833ac7fe7fa4e9e6de80345a2","closure_manifest_sha256":"sha256:163fb0f0f4cf3881fac78fa9660ffa9223cdc0b3518cbaa0aee42a12f47e5e4f","external_actions":0,"result_token":"JOBFLOW_OFFLINE_SMOKE_OK","status":"PASS","tree_sha256":"sha256:d9ebaa31948864da0ea56ff57df30d5e9755567ebde70133c349f74fc34df341"},"platform":"windows-x64","python_source":{"artifact_bytes":11009825,"artifact_name":"python-3.13.15-embed-amd64.zip","artifact_sha256":"sha256:d1f04d990aee1253d8569e8e5104e30fa9f5fa830899f14843448872d936a2cf","sigstore_bundle_bytes":7164,"sigstore_bundle_name":"python-3.13.15-embed-amd64.zip.sigstore","sigstore_bundle_sha256":"sha256:3e487c064a40d94a59476eb05e2d6225c325665590797e0a03cd33592b617137","version":"3.13.15"},"runtime_closure":{"file_count":1281,"manifest_sha256":"sha256:163fb0f0f4cf3881fac78fa9660ffa9223cdc0b3518cbaa0aee42a12f47e5e4f","platform":"windows-x64","python_version":"3.13.15","source_payload_sha256":"sha256:707238221eb22e49eda62c5b4d7bb4221738b7c833ac7fe7fa4e9e6de80345a2","total_bytes":81296431,"tree_sha256":"sha256:d9ebaa31948864da0ea56ff57df30d5e9755567ebde70133c349f74fc34df341"},"schema_version":1,"source_commit":"987e8c58826a63cf629a3c84075cf95f725efe28","structural_status":"BUILT_UNATTESTED"}